"No.","Time","Source","Destination","Protocol","Length","Info"
"1","0.000000","192.168.43.243","8.8.8.8","DNS","83","Standard query 0xa4ca AAAA ocsp.trust-provider.com"
"2","0.003684","192.168.43.243","205.185.216.10","TCP","54","55307  >  80 [ACK] Seq=1 Ack=1 Win=2825 Len=0"
"3","0.007697","192.168.43.243","205.185.216.10","TCP","54","55307  >  80 [ACK] Seq=1 Ack=2741 Win=2825 Len=0"
"4","0.008823","204.79.197.200","192.168.43.243","SSL","1424","Continuation Data"
"5","0.008825","204.79.197.200","192.168.43.243","SSL","514","Continuation Data"
"6","0.010493","192.168.43.243","204.79.197.200","TCP","54","55367  >  443 [ACK] Seq=1 Ack=1371 Win=1024 Len=0"
"7","0.010891","204.79.197.200","192.168.43.243","SSL","1424","Continuation Data"
"8","0.012743","192.168.43.243","204.79.197.200","TCP","54","55367  >  443 [ACK] Seq=1 Ack=1831 Win=1022 Len=0"
"9","0.013036","204.79.197.200","192.168.43.243","SSL","275","Continuation Data"
"10","0.013425","192.168.43.243","204.79.197.200","TCP","54","55367  >  443 [ACK] Seq=1 Ack=3201 Win=1024 Len=0"
"11","0.015285","204.79.197.200","192.168.43.243","SSL","1424","Continuation Data"
"12","0.015669","192.168.43.243","204.79.197.200","TCP","54","55367  >  443 [ACK] Seq=1 Ack=3422 Win=1023 Len=0"
"13","0.016356","192.168.43.243","204.79.197.200","TCP","54","55367  >  443 [ACK] Seq=1 Ack=4792 Win=1024 Len=0"
"14","0.017364","204.79.197.200","192.168.43.243","SSL","269","Continuation Data"
"15","0.018595","192.168.43.243","204.79.197.200","TCP","54","55367  >  443 [ACK] Seq=1 Ack=5007 Win=1023 Len=0"
"16","0.021446","192.168.43.243","205.185.216.10","TCP","54","55307  >  80 [ACK] Seq=1 Ack=5481 Win=2825 Len=0"
"17","0.026093","192.168.43.243","205.185.216.10","TCP","54","55307  >  80 [ACK] Seq=1 Ack=8193 Win=2825 Len=0"
"18","0.031072","192.168.43.243","205.185.216.10","TCP","54","55307  >  80 [ACK] Seq=1 Ack=10933 Win=2825 Len=0"
"19","0.035157","204.79.197.200","192.168.43.243","SSL","1424","Continuation Data"
"20","0.035512","204.79.197.200","192.168.43.243","SSL","687","Continuation Data"
"21","0.036032","192.168.43.243","204.79.197.200","TCP","54","55367  >  443 [ACK] Seq=1 Ack=6377 Win=1024 Len=0"
"22","0.036186","192.168.43.243","205.185.216.42","TCP","54","55357  >  80 [ACK] Seq=1 Ack=1 Win=626 Len=0"
"23","0.037797","192.168.43.243","204.79.197.200","TCP","54","55367  >  443 [ACK] Seq=1 Ack=7010 Win=1021 Len=0"
"24","0.039013","192.168.43.243","205.185.216.10","TCP","54","55307  >  80 [ACK] Seq=1 Ack=13659 Win=2825 Len=0"
"25","0.044023","192.168.43.243","205.185.216.10","TCP","54","55307  >  80 [ACK] Seq=1 Ack=16399 Win=2825 Len=0"
"26","0.048955","192.168.43.243","205.185.216.10","TCP","54","55307  >  80 [ACK] Seq=1 Ack=19139 Win=2825 Len=0"
"27","0.053362","192.168.43.243","205.185.216.10","TCP","54","55307  >  80 [ACK] Seq=1 Ack=21851 Win=2825 Len=0"
"28","0.057273","192.168.43.243","205.185.216.10","TCP","54","55307  >  80 [ACK] Seq=1 Ack=24577 Win=2825 Len=0"
"29","0.062310","192.168.43.243","205.185.216.10","TCP","54","55307  >  80 [ACK] Seq=1 Ack=27317 Win=2825 Len=0"
"30","0.068291","192.168.43.243","205.185.216.10","TCP","54","55307  >  80 [ACK] Seq=1 Ack=30057 Win=2825 Len=0"
"31","0.072235","192.168.43.243","205.185.216.10","TCP","54","55307  >  80 [ACK] Seq=1 Ack=32797 Win=2825 Len=0"
"32","0.076840","192.168.43.243","205.185.216.10","TCP","54","55307  >  80 [ACK] Seq=1 Ack=35537 Win=2825 Len=0"
"33","0.081861","192.168.43.243","205.185.216.10","TCP","54","55307  >  80 [ACK] Seq=1 Ack=38277 Win=2825 Len=0"
"34","0.086835","192.168.43.243","205.185.216.10","TCP","54","55307  >  80 [ACK] Seq=1 Ack=40961 Win=2825 Len=0"
"35","0.087979","8.8.8.8","192.168.43.243","DNS","99","Standard query response 0x6f2a A ocsp.trust-provider.com A 178.255.83.1"
"36","0.090954","192.168.43.243","205.185.216.10","TCP","54","55307  >  80 [ACK] Seq=1 Ack=43701 Win=2825 Len=0"
"37","0.095787","192.168.43.243","205.185.216.10","TCP","54","55307  >  80 [ACK] Seq=1 Ack=46441 Win=2825 Len=0"
"38","0.100266","192.168.43.243","205.185.216.10","TCP","54","55307  >  80 [ACK] Seq=1 Ack=49181 Win=2825 Len=0"
"39","0.106022","8.8.8.8","192.168.43.243","DNS","111","Standard query response 0xa4ca AAAA ocsp.trust-provider.com AAAA 2a02:1788:2fd::b2ff:5301"
"40","0.106941","192.168.43.243","205.185.216.10","TCP","54","55307  >  80 [ACK] Seq=1 Ack=51921 Win=2825 Len=0"
"41","0.107254","2405:204:919e:7f6f:c9a4:1a10:85cb:e7af","2a02:1788:2fd::b2ff:5301","TCP","86","55382  >  80 [SYN] Seq=0 Win=17654 Len=0 MSS=1358 WS=256 SACK_PERM=1"
"42","0.110281","192.168.43.243","205.185.216.10","TCP","54","55307  >  80 [ACK] Seq=1 Ack=54661 Win=2825 Len=0"
"43","0.115054","192.168.43.243","205.185.216.42","TCP","54","55357  >  80 [ACK] Seq=1 Ack=2741 Win=626 Len=0"
"44","0.120740","192.168.43.243","205.185.216.42","TCP","54","55357  >  80 [ACK] Seq=1 Ack=5481 Win=626 Len=0"
"45","0.127967","192.168.43.243","205.185.216.42","HTTP","499","GET /filestreamingservice/files/c1371070-13b3-4765-9782-10e387096f42?P1=1539930398&P2=402&P3=2&P4=crnbcJQoqZ7M91qYa%2bPIAxUc4WhZu%2bGZZGw5VxKkqtZsI5ABTKXCwOkbUhzNNWSHY%2bEKbKs8Arxth14D4tFs%2bQ%3d%3d HTTP/1.1 "
"46","0.199412","205.185.216.10","192.168.43.243","HTTP","1424","Continuation"
"47","0.200550","205.185.216.10","192.168.43.243","HTTP","1424","Continuation"
"48","0.200552","205.185.216.10","192.168.43.243","HTTP","1424","Continuation"
"49","0.201254","205.185.216.10","192.168.43.243","HTTP","1424","Continuation"
"50","0.201569","192.168.43.243","205.185.216.10","TCP","54","55307  >  80 [ACK] Seq=1 Ack=57401 Win=2825 Len=0"
"51","0.201921","192.168.43.243","205.185.216.10","TCP","54","55307  >  80 [ACK] Seq=1 Ack=60141 Win=2825 Len=0"
"52","0.220759","205.185.216.10","192.168.43.243","HTTP","1354","Continuation"
"53","0.227066","192.168.43.243","205.185.216.10","HTTP","500","GET /filestreamingservice/files/c1371070-13b3-4765-9782-10e387096f42?P1=1539930398&P2=402&P3=2&P4=crnbcJQoqZ7M91qYa%2bPIAxUc4WhZu%2bGZZGw5VxKkqtZsI5ABTKXCwOkbUhzNNWSHY%2bEKbKs8Arxth14D4tFs%2bQ%3d%3d HTTP/1.1 "
"54","0.350888","205.185.216.42","192.168.43.243","TCP","54","80  >  55357 [ACK] Seq=6823 Ack=446 Win=60 Len=0"
"55","0.360523","205.185.216.42","192.168.43.243","TCP","54","[TCP Keep-Alive] 80  >  55357 [ACK] Seq=6822 Ack=446 Win=60 Len=0"
"56","0.360524","205.185.216.42","192.168.43.243","TCP","444","80  >  55357 [PSH, ACK] Seq=6823 Ack=446 Win=60 Len=390 [TCP segment of a reassembled PDU]"
"57","0.360804","192.168.43.243","205.185.216.42","TCP","54","[TCP Dup ACK 45#1] 55357  >  80 [ACK] Seq=446 Ack=6823 Win=620 Len=0"
"58","0.363960","205.185.216.42","192.168.43.243","TCP","1424","80  >  55357 [ACK] Seq=7213 Ack=446 Win=60 Len=1370 [TCP segment of a reassembled PDU]"
"59","0.363962","205.185.216.42","192.168.43.243","TCP","1424","80  >  55357 [ACK] Seq=8583 Ack=446 Win=60 Len=1370 [TCP segment of a reassembled PDU]"
"60","0.363965","205.185.216.42","192.168.43.243","TCP","1410","80  >  55357 [PSH, ACK] Seq=9953 Ack=446 Win=60 Len=1356 [TCP segment of a reassembled PDU]"
"61","0.363966","205.185.216.42","192.168.43.243","TCP","1424","80  >  55357 [ACK] Seq=11309 Ack=446 Win=60 Len=1370 [TCP segment of a reassembled PDU]"
"62","0.363967","205.185.216.42","192.168.43.243","TCP","1424","80  >  55357 [ACK] Seq=12679 Ack=446 Win=60 Len=1370 [TCP segment of a reassembled PDU]"
"63","0.363968","205.185.216.42","192.168.43.243","TCP","1424","80  >  55357 [ACK] Seq=14049 Ack=446 Win=60 Len=1370 [TCP segment of a reassembled PDU]"
"64","0.363969","205.185.216.42","192.168.43.243","TCP","1424","80  >  55357 [ACK] Seq=15419 Ack=446 Win=60 Len=1370 [TCP segment of a reassembled PDU]"
"65","0.363970","205.185.216.42","192.168.43.243","TCP","1424","80  >  55357 [ACK] Seq=16789 Ack=446 Win=60 Len=1370 [TCP segment of a reassembled PDU]"
"66","0.363971","205.185.216.42","192.168.43.243","TCP","1396","80  >  55357 [PSH, ACK] Seq=18159 Ack=446 Win=60 Len=1342 [TCP segment of a reassembled PDU]"
"67","0.363972","205.185.216.42","192.168.43.243","TCP","1424","80  >  55357 [ACK] Seq=19501 Ack=446 Win=60 Len=1370 [TCP segment of a reassembled PDU]"
"68","0.363973","205.185.216.42","192.168.43.243","TCP","1424","80  >  55357 [ACK] Seq=20871 Ack=446 Win=60 Len=1370 [TCP segment of a reassembled PDU]"
"69","0.363974","205.185.216.42","192.168.43.243","TCP","1424","80  >  55357 [ACK] Seq=22241 Ack=446 Win=60 Len=1370 [TCP segment of a reassembled PDU]"
"70","0.363975","205.185.216.42","192.168.43.243","TCP","1424","80  >  55357 [ACK] Seq=23611 Ack=446 Win=60 Len=1370 [TCP segment of a reassembled PDU]"
"71","0.363976","205.185.216.42","192.168.43.243","TCP","1424","80  >  55357 [ACK] Seq=24981 Ack=446 Win=60 Len=1370 [TCP segment of a reassembled PDU]"
"72","0.363977","205.185.216.42","192.168.43.243","TCP","1424","80  >  55357 [ACK] Seq=26351 Ack=446 Win=60 Len=1370 [TCP segment of a reassembled PDU]"
"73","0.363978","205.185.216.42","192.168.43.243","TCP","1424","80  >  55357 [ACK] Seq=27721 Ack=446 Win=60 Len=1370 [TCP segment of a reassembled PDU]"
"74","0.363979","205.185.216.42","192.168.43.243","TCP","1424","80  >  55357 [ACK] Seq=29091 Ack=446 Win=60 Len=1370 [TCP segment of a reassembled PDU]"
"75","0.366884","192.168.43.243","205.185.216.42","TCP","54","55357  >  80 [ACK] Seq=446 Ack=8583 Win=626 Len=0"
"76","0.366887","205.185.216.42","192.168.43.243","TCP","1382","80  >  55357 [PSH, ACK] Seq=30461 Ack=446 Win=60 Len=1328 [TCP segment of a reassembled PDU]"
"77","0.366889","205.185.216.42","192.168.43.243","TCP","1424","80  >  55357 [ACK] Seq=31789 Ack=446 Win=60 Len=1370 [TCP segment of a reassembled PDU]"
"78","0.367351","205.185.216.42","192.168.43.243","TCP","1424","80  >  55357 [ACK] Seq=33159 Ack=446 Win=60 Len=1370 [TCP segment of a reassembled PDU]"
"79","0.367359","192.168.43.243","205.185.216.42","TCP","54","55357  >  80 [ACK] Seq=446 Ack=11309 Win=626 Len=0"
"80","0.367556","205.185.216.42","192.168.43.243","TCP","1424","80  >  55357 [ACK] Seq=34529 Ack=446 Win=60 Len=1370 [TCP segment of a reassembled PDU]"
"81","0.367559","205.185.216.42","192.168.43.243","TCP","1424","80  >  55357 [ACK] Seq=35899 Ack=446 Win=60 Len=1370 [TCP segment of a reassembled PDU]"
"82","0.367901","192.168.43.243","205.185.216.42","TCP","54","55357  >  80 [ACK] Seq=446 Ack=14049 Win=626 Len=0"
"83","0.367993","205.185.216.42","192.168.43.243","TCP","1424","80  >  55357 [ACK] Seq=37269 Ack=446 Win=60 Len=1370 [TCP segment of a reassembled PDU]"
"84","0.368326","192.168.43.243","205.185.216.42","TCP","54","55357  >  80 [ACK] Seq=446 Ack=16789 Win=626 Len=0"
"85","0.368586","192.168.43.243","205.185.216.42","TCP","54","55357  >  80 [ACK] Seq=446 Ack=19501 Win=626 Len=0"
"86","0.368840","192.168.43.243","205.185.216.42","TCP","54","55357  >  80 [ACK] Seq=446 Ack=22241 Win=626 Len=0"
"87","0.369107","192.168.43.243","205.185.216.42","TCP","54","55357  >  80 [ACK] Seq=446 Ack=24981 Win=626 Len=0"
"88","0.369352","192.168.43.243","205.185.216.42","TCP","54","55357  >  80 [ACK] Seq=446 Ack=27721 Win=626 Len=0"
"89","0.369598","192.168.43.243","205.185.216.42","TCP","54","55357  >  80 [ACK] Seq=446 Ack=30461 Win=626 Len=0"
"90","0.369860","192.168.43.243","205.185.216.42","TCP","54","55357  >  80 [ACK] Seq=446 Ack=33159 Win=626 Len=0"
"91","0.370117","192.168.43.243","205.185.216.42","TCP","54","55357  >  80 [ACK] Seq=446 Ack=35899 Win=626 Len=0"
"92","0.370361","192.168.43.243","205.185.216.42","TCP","54","55357  >  80 [ACK] Seq=446 Ack=38639 Win=626 Len=0"
"93","0.370958","205.185.216.42","192.168.43.243","TCP","1424","80  >  55357 [ACK] Seq=38639 Ack=446 Win=60 Len=1370 [TCP segment of a reassembled PDU]"
"94","0.372488","205.185.216.42","192.168.43.243","TCP","1424","80  >  55357 [ACK] Seq=40009 Ack=446 Win=60 Len=1370 [TCP segment of a reassembled PDU]"
"95","0.372918","192.168.43.243","205.185.216.42","TCP","54","55357  >  80 [ACK] Seq=446 Ack=41379 Win=626 Len=0"
"96","0.375902","205.185.216.42","192.168.43.243","TCP","1424","80  >  55357 [ACK] Seq=41379 Ack=446 Win=60 Len=1370 [TCP segment of a reassembled PDU]"
"97","0.375904","205.185.216.42","192.168.43.243","TCP","1424","80  >  55357 [ACK] Seq=42749 Ack=446 Win=60 Len=1370 [TCP segment of a reassembled PDU]"
"98","0.376697","192.168.43.243","205.185.216.42","TCP","54","55357  >  80 [ACK] Seq=446 Ack=44119 Win=626 Len=0"
"99","0.378337","205.185.216.42","192.168.43.243","TCP","1424","80  >  55357 [ACK] Seq=44119 Ack=446 Win=60 Len=1370 [TCP segment of a reassembled PDU]"
"100","0.381549","205.185.216.42","192.168.43.243","TCP","1424","80  >  55357 [ACK] Seq=45489 Ack=446 Win=60 Len=1370 [TCP segment of a reassembled PDU]"
"101","0.381550","205.185.216.42","192.168.43.243","TCP","1424","80  >  55357 [ACK] Seq=46859 Ack=446 Win=60 Len=1370 [TCP segment of a reassembled PDU]"
"102","0.382144","192.168.43.243","205.185.216.42","TCP","54","55357  >  80 [ACK] Seq=446 Ack=46859 Win=626 Len=0"
"103","0.383637","205.185.216.42","192.168.43.243","TCP","1424","80  >  55357 [ACK] Seq=48229 Ack=446 Win=60 Len=1370 [TCP segment of a reassembled PDU]"
"104","0.384092","192.168.43.243","205.185.216.42","TCP","54","55357  >  80 [ACK] Seq=446 Ack=49599 Win=626 Len=0"
"105","0.384964","205.185.216.42","192.168.43.243","TCP","1424","80  >  55357 [ACK] Seq=49599 Ack=446 Win=60 Len=1370 [TCP segment of a reassembled PDU]"
"106","0.387506","205.185.216.42","192.168.43.243","TCP","1424","80  >  55357 [ACK] Seq=50969 Ack=446 Win=60 Len=1370 [TCP segment of a reassembled PDU]"
"107","0.387507","205.185.216.42","192.168.43.243","TCP","1424","80  >  55357 [ACK] Seq=52339 Ack=446 Win=60 Len=1370 [TCP segment of a reassembled PDU]"
"108","0.388195","192.168.43.243","205.185.216.42","TCP","54","55357  >  80 [ACK] Seq=446 Ack=52339 Win=626 Len=0"
"109","0.392192","205.185.216.42","192.168.43.243","TCP","1424","80  >  55357 [ACK] Seq=53709 Ack=446 Win=60 Len=1370 [TCP segment of a reassembled PDU]"
"110","0.392689","192.168.43.243","205.185.216.42","TCP","54","55357  >  80 [ACK] Seq=446 Ack=55079 Win=626 Len=0"
"111","0.393116","205.185.216.42","192.168.43.243","TCP","1340","80  >  55357 [PSH, ACK] Seq=55079 Ack=446 Win=60 Len=1286 [TCP segment of a reassembled PDU]"
"112","0.393120","205.185.216.42","192.168.43.243","TCP","1424","80  >  55357 [ACK] Seq=56365 Ack=446 Win=60 Len=1370 [TCP segment of a reassembled PDU]"
"113","0.394048","192.168.43.243","205.185.216.42","TCP","54","55357  >  80 [ACK] Seq=446 Ack=57735 Win=626 Len=0"
"114","0.396220","205.185.216.42","192.168.43.243","TCP","1424","80  >  55357 [ACK] Seq=57735 Ack=446 Win=60 Len=1370 [TCP segment of a reassembled PDU]"
"115","0.397032","205.185.216.42","192.168.43.243","TCP","1424","80  >  55357 [ACK] Seq=59105 Ack=446 Win=60 Len=1370 [TCP segment of a reassembled PDU]"
"116","0.397634","192.168.43.243","205.185.216.42","TCP","54","55357  >  80 [ACK] Seq=446 Ack=60475 Win=626 Len=0"
"117","0.403192","205.185.216.42","192.168.43.243","TCP","1424","80  >  55357 [ACK] Seq=60475 Ack=446 Win=60 Len=1370 [TCP segment of a reassembled PDU]"
"118","0.403193","205.185.216.42","192.168.43.243","TCP","1424","80  >  55357 [ACK] Seq=61845 Ack=446 Win=60 Len=1370 [TCP segment of a reassembled PDU]"
"119","0.403197","205.185.216.42","192.168.43.243","TCP","1424","80  >  55357 [ACK] Seq=63215 Ack=446 Win=60 Len=1370 [TCP segment of a reassembled PDU]"
"120","0.404072","192.168.43.243","205.185.216.42","TCP","54","55357  >  80 [ACK] Seq=446 Ack=63215 Win=626 Len=0"
"121","0.404418","205.185.216.42","192.168.43.243","TCP","1424","80  >  55357 [ACK] Seq=64585 Ack=446 Win=60 Len=1370 [TCP segment of a reassembled PDU]"
"122","0.404422","2a02:1788:2fd::b2ff:5301","2405:204:919e:7f6f:c9a4:1a10:85cb:e7af","TCP","86","80  >  55382 [SYN, ACK] Seq=0 Ack=1 Win=14400 Len=0 MSS=1370 SACK_PERM=1 WS=512"
"123","0.404821","2405:204:919e:7f6f:c9a4:1a10:85cb:e7af","2a02:1788:2fd::b2ff:5301","TCP","74","55382  >  80 [ACK] Seq=1 Ack=1 Win=17408 Len=0"
"124","0.405147","2405:204:919e:7f6f:c9a4:1a10:85cb:e7af","2a02:1788:2fd::b2ff:5301","HTTP","316","GET /MFEwTzBNMEswSTAJBgUrDgMCGgUABBR8sWZUnKvbRO5iJhat9GV793rVlAQUrb2YejS0Jvf6xCZU7wO94CTLVBoCEENSAj%2F6qJAfE5%2Fj9OXBRE4%3D HTTP/1.1 "
"125","0.405185","192.168.43.243","205.185.216.42","TCP","54","55357  >  80 [ACK] Seq=446 Ack=65955 Win=626 Len=0"
"126","0.418915","205.185.216.10","192.168.43.243","TCP","54","80  >  55307 [ACK] Seq=61441 Ack=447 Win=60 Len=0"
"127","0.420832","205.185.216.10","192.168.43.243","TCP","444","80  >  55307 [PSH, ACK] Seq=61441 Ack=447 Win=60 Len=390 [TCP segment of a reassembled PDU]"
"128","0.422316","205.185.216.10","192.168.43.243","TCP","1424","80  >  55307 [ACK] Seq=61831 Ack=447 Win=60 Len=1370 [TCP segment of a reassembled PDU]"
"129","0.422317","205.185.216.10","192.168.43.243","TCP","1424","80  >  55307 [ACK] Seq=63201 Ack=447 Win=60 Len=1370 [TCP segment of a reassembled PDU]"
"130","0.422861","205.185.216.10","192.168.43.243","TCP","1410","80  >  55307 [PSH, ACK] Seq=64571 Ack=447 Win=60 Len=1356 [TCP segment of a reassembled PDU]"
"131","0.423103","192.168.43.243","205.185.216.10","TCP","54","55307  >  80 [ACK] Seq=447 Ack=63201 Win=2825 Len=0"
"132","0.423491","192.168.43.243","205.185.216.10","TCP","54","55307  >  80 [ACK] Seq=447 Ack=65927 Win=2825 Len=0"
"133","0.424902","205.185.216.10","192.168.43.243","TCP","1424","80  >  55307 [ACK] Seq=65927 Ack=447 Win=60 Len=1370 [TCP segment of a reassembled PDU]"
"134","0.426673","205.185.216.10","192.168.43.243","TCP","1424","80  >  55307 [ACK] Seq=67297 Ack=447 Win=60 Len=1370 [TCP segment of a reassembled PDU]"
"135","0.426675","205.185.216.10","192.168.43.243","TCP","1424","80  >  55307 [ACK] Seq=68667 Ack=447 Win=60 Len=1370 [TCP segment of a reassembled PDU]"
"136","0.427281","192.168.43.243","205.185.216.10","TCP","54","55307  >  80 [ACK] Seq=447 Ack=68667 Win=2825 Len=0"
"137","0.429184","205.185.216.10","192.168.43.243","TCP","1424","80  >  55307 [ACK] Seq=70037 Ack=447 Win=60 Len=1370 [TCP segment of a reassembled PDU]"
"138","0.429186","205.185.216.10","192.168.43.243","TCP","1424","80  >  55307 [ACK] Seq=71407 Ack=447 Win=60 Len=1370 [TCP segment of a reassembled PDU]"
"139","0.429189","205.185.216.10","192.168.43.243","TCP","1424","80  >  55307 [ACK] Seq=72777 Ack=447 Win=60 Len=1370 [TCP segment of a reassembled PDU]"
"140","0.429931","192.168.43.243","205.185.216.10","TCP","54","55307  >  80 [ACK] Seq=447 Ack=71407 Win=2825 Len=0"
"141","0.430259","192.168.43.243","205.185.216.10","TCP","54","55307  >  80 [ACK] Seq=447 Ack=74147 Win=2825 Len=0"
"142","0.431533","205.185.216.10","192.168.43.243","TCP","1424","80  >  55307 [ACK] Seq=74147 Ack=447 Win=60 Len=1370 [TCP segment of a reassembled PDU]"
"143","0.431535","205.185.216.10","192.168.43.243","TCP","1424","80  >  55307 [ACK] Seq=75517 Ack=447 Win=60 Len=1370 [TCP segment of a reassembled PDU]"
"144","0.432225","192.168.43.243","205.185.216.10","TCP","54","55307  >  80 [ACK] Seq=447 Ack=76887 Win=2825 Len=0"
"145","0.438683","205.185.216.10","192.168.43.243","TCP","1424","80  >  55307 [ACK] Seq=76887 Ack=447 Win=60 Len=1370 [TCP segment of a reassembled PDU]"
"146","0.438684","205.185.216.10","192.168.43.243","TCP","1424","80  >  55307 [ACK] Seq=78257 Ack=447 Win=60 Len=1370 [TCP segment of a reassembled PDU]"
"147","0.438688","205.185.216.10","192.168.43.243","TCP","1424","80  >  55307 [ACK] Seq=79627 Ack=447 Win=60 Len=1370 [TCP segment of a reassembled PDU]"
"148","0.438689","205.185.216.10","192.168.43.243","TCP","1424","80  >  55307 [ACK] Seq=80997 Ack=447 Win=60 Len=1370 [TCP segment of a reassembled PDU]"
"149","0.439751","192.168.43.243","205.185.216.10","TCP","54","55307  >  80 [ACK] Seq=447 Ack=79627 Win=2825 Len=0"
"150","0.440202","192.168.43.243","205.185.216.10","TCP","54","55307  >  80 [ACK] Seq=447 Ack=82367 Win=2825 Len=0"
"151","0.441387","205.185.216.10","192.168.43.243","TCP","1424","80  >  55307 [ACK] Seq=82367 Ack=447 Win=60 Len=1370 [TCP segment of a reassembled PDU]"
"152","0.441676","205.185.216.10","192.168.43.243","TCP","1424","80  >  55307 [ACK] Seq=83737 Ack=447 Win=60 Len=1370 [TCP segment of a reassembled PDU]"
"153","0.442149","192.168.43.243","205.185.216.10","TCP","54","55307  >  80 [ACK] Seq=447 Ack=85107 Win=2825 Len=0"
"154","0.442478","205.185.216.10","192.168.43.243","TCP","1424","80  >  55307 [ACK] Seq=85107 Ack=447 Win=60 Len=1370 [TCP segment of a reassembled PDU]"
"155","0.442483","205.185.216.10","192.168.43.243","TCP","1424","80  >  55307 [ACK] Seq=86477 Ack=447 Win=60 Len=1370 [TCP segment of a reassembled PDU]"
"156","0.442484","205.185.216.10","192.168.43.243","TCP","1424","80  >  55307 [ACK] Seq=87847 Ack=447 Win=60 Len=1370 [TCP segment of a reassembled PDU]"
"157","0.443456","192.168.43.243","205.185.216.10","TCP","54","55307  >  80 [ACK] Seq=447 Ack=87847 Win=2825 Len=0"
"158","0.446613","205.185.216.10","192.168.43.243","TCP","1424","80  >  55307 [ACK] Seq=89217 Ack=447 Win=60 Len=1370 [TCP segment of a reassembled PDU]"
"159","0.447149","192.168.43.243","205.185.216.10","TCP","54","55307  >  80 [ACK] Seq=447 Ack=90587 Win=2825 Len=0"
"160","0.452672","205.185.216.10","192.168.43.243","TCP","1424","80  >  55307 [ACK] Seq=90587 Ack=447 Win=60 Len=1370 [TCP segment of a reassembled PDU]"
"161","0.458485","205.185.216.10","192.168.43.243","TCP","1424","80  >  55307 [ACK] Seq=91957 Ack=447 Win=60 Len=1370 [TCP segment of a reassembled PDU]"
"162","0.458983","192.168.43.243","205.185.216.10","TCP","54","55307  >  80 [ACK] Seq=447 Ack=93327 Win=2825 Len=0"
"163","0.460943","205.185.216.10","192.168.43.243","TCP","1424","80  >  55307 [ACK] Seq=93327 Ack=447 Win=60 Len=1370 [TCP segment of a reassembled PDU]"
"164","0.461269","205.185.216.10","192.168.43.243","TCP","1424","80  >  55307 [ACK] Seq=94697 Ack=447 Win=60 Len=1370 [TCP segment of a reassembled PDU]"
"165","0.461569","205.185.216.10","192.168.43.243","TCP","1424","80  >  55307 [ACK] Seq=96067 Ack=447 Win=60 Len=1370 [TCP segment of a reassembled PDU]"
"166","0.461891","205.185.216.10","192.168.43.243","TCP","1424","80  >  55307 [ACK] Seq=97437 Ack=447 Win=60 Len=1370 [TCP segment of a reassembled PDU]"
"167","0.462238","192.168.43.243","205.185.216.10","TCP","54","55307  >  80 [ACK] Seq=447 Ack=96067 Win=2825 Len=0"
"168","0.462549","192.168.43.243","205.185.216.10","TCP","54","55307  >  80 [ACK] Seq=447 Ack=98807 Win=2825 Len=0"
"169","0.464701","205.185.216.10","192.168.43.243","TCP","1424","80  >  55307 [ACK] Seq=98807 Ack=447 Win=60 Len=1370 [TCP segment of a reassembled PDU]"
"170","0.465078","205.185.216.10","192.168.43.243","TCP","1424","80  >  55307 [ACK] Seq=100177 Ack=447 Win=60 Len=1370 [TCP segment of a reassembled PDU]"
"171","0.465538","192.168.43.243","205.185.216.10","TCP","54","55307  >  80 [ACK] Seq=447 Ack=101547 Win=2825 Len=0"
"172","0.467553","205.185.216.10","192.168.43.243","TCP","1424","80  >  55307 [ACK] Seq=101547 Ack=447 Win=60 Len=1370 [TCP segment of a reassembled PDU]"
"173","0.471927","205.185.216.10","192.168.43.243","TCP","1424","80  >  55307 [ACK] Seq=102917 Ack=447 Win=60 Len=1370 [TCP segment of a reassembled PDU]"
"174","0.471928","205.185.216.10","192.168.43.243","TCP","1424","80  >  55307 [ACK] Seq=104287 Ack=447 Win=60 Len=1370 [TCP segment of a reassembled PDU]"
"175","0.471932","205.185.216.10","192.168.43.243","TCP","1424","80  >  55307 [ACK] Seq=105657 Ack=447 Win=60 Len=1370 [TCP segment of a reassembled PDU]"
"176","0.472711","192.168.43.243","205.185.216.10","TCP","54","55307  >  80 [ACK] Seq=447 Ack=104287 Win=2825 Len=0"
"177","0.473130","192.168.43.243","205.185.216.10","TCP","54","55307  >  80 [ACK] Seq=447 Ack=107027 Win=2825 Len=0"
"178","0.475466","205.185.216.10","192.168.43.243","TCP","1424","80  >  55307 [ACK] Seq=107027 Ack=447 Win=60 Len=1370 [TCP segment of a reassembled PDU]"
"179","0.475836","205.185.216.10","192.168.43.243","TCP","1424","80  >  55307 [ACK] Seq=108397 Ack=447 Win=60 Len=1370 [TCP segment of a reassembled PDU]"
"180","0.476899","192.168.43.243","205.185.216.10","TCP","54","55307  >  80 [ACK] Seq=447 Ack=109767 Win=2825 Len=0"
"181","0.477335","205.185.216.10","192.168.43.243","TCP","1424","80  >  55307 [ACK] Seq=109767 Ack=447 Win=60 Len=1370 [TCP segment of a reassembled PDU]"
"182","0.478122","205.185.216.10","192.168.43.243","TCP","1424","80  >  55307 [ACK] Seq=111137 Ack=447 Win=60 Len=1370 [TCP segment of a reassembled PDU]"
"183","0.478126","205.185.216.10","192.168.43.243","TCP","1424","80  >  55307 [ACK] Seq=112507 Ack=447 Win=60 Len=1370 [TCP segment of a reassembled PDU]"
"184","0.478719","192.168.43.243","205.185.216.10","TCP","54","55307  >  80 [ACK] Seq=447 Ack=112507 Win=2825 Len=0"
"185","0.480490","205.185.216.10","192.168.43.243","TCP","1424","80  >  55307 [ACK] Seq=113877 Ack=447 Win=60 Len=1370 [TCP segment of a reassembled PDU]"
"186","0.480492","205.185.216.10","192.168.43.243","TCP","1424","80  >  55307 [ACK] Seq=115247 Ack=447 Win=60 Len=1370 [TCP segment of a reassembled PDU]"
"187","0.480965","205.185.216.10","192.168.43.243","TCP","1424","80  >  55307 [ACK] Seq=116617 Ack=447 Win=60 Len=1370 [TCP segment of a reassembled PDU]"
"188","0.481168","192.168.43.243","205.185.216.10","TCP","54","55307  >  80 [ACK] Seq=447 Ack=115247 Win=2825 Len=0"
"189","0.481502","192.168.43.243","205.185.216.10","TCP","54","55307  >  80 [ACK] Seq=447 Ack=117987 Win=2825 Len=0"
"190","0.482510","205.185.216.10","192.168.43.243","TCP","1424","80  >  55307 [ACK] Seq=117987 Ack=447 Win=60 Len=1370 [TCP segment of a reassembled PDU]"
"191","0.484657","205.185.216.10","192.168.43.243","TCP","1424","80  >  55307 [ACK] Seq=119357 Ack=447 Win=60 Len=1370 [TCP segment of a reassembled PDU]"
"192","0.485094","205.185.216.10","192.168.43.243","TCP","1424","80  >  55307 [ACK] Seq=120727 Ack=447 Win=60 Len=1370 [TCP segment of a reassembled PDU]"
"193","0.485099","192.168.43.243","205.185.216.10","TCP","54","55307  >  80 [ACK] Seq=447 Ack=120727 Win=2825 Len=0"
"194","0.485615","205.185.216.10","192.168.43.243","TCP","1424","80  >  55307 [ACK] Seq=122097 Ack=447 Win=60 Len=1370 [TCP segment of a reassembled PDU]"
"195","0.486139","192.168.43.243","205.185.216.10","TCP","54","55307  >  80 [ACK] Seq=447 Ack=123467 Win=2825 Len=0"
"196","0.487649","205.185.216.10","192.168.43.243","TCP","1424","80  >  55307 [ACK] Seq=123467 Ack=447 Win=60 Len=1370 [TCP segment of a reassembled PDU]"
"197","0.490619","205.185.216.10","192.168.43.243","TCP","1424","80  >  55307 [ACK] Seq=124837 Ack=447 Win=60 Len=1370 [TCP segment of a reassembled PDU]"
"198","0.490920","205.185.216.10","192.168.43.243","HTTP","1214","HTTP/1.1 206 Partial Content  (application/octet-stream)"
"199","0.491218","192.168.43.243","205.185.216.10","TCP","54","55307  >  80 [ACK] Seq=447 Ack=126207 Win=2825 Len=0"
"200","0.531140","192.168.43.243","205.185.216.10","TCP","54","55307  >  80 [ACK] Seq=447 Ack=127367 Win=2821 Len=0"
"201","0.564858","205.185.216.42","192.168.43.243","TCP","1424","80  >  55357 [ACK] Seq=65955 Ack=446 Win=60 Len=1370 [TCP segment of a reassembled PDU]"
"202","0.565563","205.185.216.42","192.168.43.243","TCP","1424","80  >  55357 [ACK] Seq=67325 Ack=446 Win=60 Len=1370 [TCP segment of a reassembled PDU]"
"203","0.566001","205.185.216.42","192.168.43.243","TCP","1424","80  >  55357 [ACK] Seq=68695 Ack=446 Win=60 Len=1370 [TCP segment of a reassembled PDU]"
"204","0.566301","192.168.43.243","205.185.216.42","TCP","54","55357  >  80 [ACK] Seq=446 Ack=68695 Win=626 Len=0"
"205","0.566766","205.185.216.42","192.168.43.243","TCP","1424","80  >  55357 [ACK] Seq=70065 Ack=446 Win=60 Len=1370 [TCP segment of a reassembled PDU]"
"206","0.566776","205.185.216.42","192.168.43.243","HTTP","1368","HTTP/1.1 206 Partial Content  (application/octet-stream)"
"207","0.567518","192.168.43.243","205.185.216.42","TCP","54","55357  >  80 [ACK] Seq=446 Ack=71435 Win=626 Len=0"
"208","0.608397","192.168.43.243","205.185.216.42","TCP","54","55357  >  80 [ACK] Seq=446 Ack=72749 Win=621 Len=0"
"209","0.625068","2405:204:919e:7f6f:c9a4:1a10:85cb:e7af","2404:6800:4009:810::2003","UDP","85","57929  >  443 Len=23"
"210","0.710936","2404:6800:4009:810::2003","2405:204:919e:7f6f:c9a4:1a10:85cb:e7af","UDP","82","443  >  57929 Len=20"
"211","0.712133","2a02:1788:2fd::b2ff:5301","2405:204:919e:7f6f:c9a4:1a10:85cb:e7af","TCP","74","80  >  55382 [ACK] Seq=1 Ack=243 Win=15872 Len=0"
"212","0.712134","2a02:1788:2fd::b2ff:5301","2405:204:919e:7f6f:c9a4:1a10:85cb:e7af","OCSP","934","Response"
"213","0.712333","2a02:1788:2fd::b2ff:5301","2405:204:919e:7f6f:c9a4:1a10:85cb:e7af","TCP","74","80  >  55382 [FIN, ACK] Seq=861 Ack=243 Win=15872 Len=0"
"214","0.712441","2405:204:919e:7f6f:c9a4:1a10:85cb:e7af","2a02:1788:2fd::b2ff:5301","TCP","74","55382  >  80 [ACK] Seq=243 Ack=862 Win=16640 Len=0"
"215","0.712502","2405:204:919e:7f6f:c9a4:1a10:85cb:e7af","2a02:1788:2fd::b2ff:5301","TCP","74","55382  >  80 [FIN, ACK] Seq=243 Ack=862 Win=16640 Len=0"
"216","0.741610","192.168.43.243","8.8.8.8","DNS","78","Standard query 0x7974 A ocsp.comodoca4.com"
"217","0.742355","192.168.43.243","8.8.8.8","DNS","78","Standard query 0x67a6 AAAA ocsp.comodoca4.com"
"218","0.871221","192.168.43.243","205.185.216.42","HTTP","499","GET /filestreamingservice/files/c1371070-13b3-4765-9782-10e387096f42?P1=1539930398&P2=402&P3=2&P4=crnbcJQoqZ7M91qYa%2bPIAxUc4WhZu%2bGZZGw5VxKkqtZsI5ABTKXCwOkbUhzNNWSHY%2bEKbKs8Arxth14D4tFs%2bQ%3d%3d HTTP/1.1 "
"219","0.908925","8.8.8.8","192.168.43.243","DNS","187","Standard query response 0x7974 A ocsp.comodoca4.com CNAME ocsp.comodoca4.com.edgesuite.net CNAME a875.dscb.akamai.net A 49.44.197.104 A 49.44.197.9"
"220","0.914318","8.8.8.8","192.168.43.243","DNS","211","Standard query response 0x67a6 AAAA ocsp.comodoca4.com CNAME ocsp.comodoca4.com.edgesuite.net CNAME a875.dscb.akamai.net AAAA 2405:200:1602::312c:769e AAAA 2405:200:1602::312c:3228"
"221","0.915888","2405:204:919e:7f6f:c9a4:1a10:85cb:e7af","2405:200:1602::312c:769e","TCP","86","55383  >  80 [SYN] Seq=0 Win=17654 Len=0 MSS=1358 WS=256 SACK_PERM=1"
"222","0.969667","192.168.43.243","205.185.216.10","HTTP","500","GET /filestreamingservice/files/c1371070-13b3-4765-9782-10e387096f42?P1=1539930398&P2=402&P3=2&P4=crnbcJQoqZ7M91qYa%2bPIAxUc4WhZu%2bGZZGw5VxKkqtZsI5ABTKXCwOkbUhzNNWSHY%2bEKbKs8Arxth14D4tFs%2bQ%3d%3d HTTP/1.1 "
"223","0.981628","2405:200:1602::312c:769e","2405:204:919e:7f6f:c9a4:1a10:85cb:e7af","TCP","86","80  >  55383 [SYN, ACK] Seq=0 Ack=1 Win=28800 Len=0 MSS=1370 SACK_PERM=1 WS=128"
"224","0.981826","2405:204:919e:7f6f:c9a4:1a10:85cb:e7af","2405:200:1602::312c:769e","TCP","74","55383  >  80 [ACK] Seq=1 Ack=1 Win=17408 Len=0"
"225","0.982073","2405:204:919e:7f6f:c9a4:1a10:85cb:e7af","2405:200:1602::312c:769e","HTTP","311","GET /MFEwTzBNMEswSTAJBgUrDgMCGgUABBTrJdiQ%2Ficg9B19asFe73bPYs%2BreAQUdXGnGUgZvJ2d6kFH35TESHeZ03kCEFslzmkHxCZVZtM5DJmpVK0%3D HTTP/1.1 "
"226","1.019292","2a02:1788:2fd::b2ff:5301","2405:204:919e:7f6f:c9a4:1a10:85cb:e7af","TCP","74","80  >  55382 [ACK] Seq=862 Ack=244 Win=15872 Len=0"
"227","1.069419","2405:200:1602::312c:769e","2405:204:919e:7f6f:c9a4:1a10:85cb:e7af","TCP","74","80  >  55383 [ACK] Seq=1 Ack=238 Win=29952 Len=0"
"228","1.069420","2405:200:1602::312c:769e","2405:204:919e:7f6f:c9a4:1a10:85cb:e7af","OCSP","785","Response"
"229","1.076132","205.185.216.42","192.168.43.243","TCP","54","80  >  55357 [ACK] Seq=72749 Ack=891 Win=60 Len=0"
"230","1.079958","205.185.216.42","192.168.43.243","TCP","54","[TCP Keep-Alive] 80  >  55357 [ACK] Seq=72748 Ack=891 Win=60 Len=0"
"231","1.080083","192.168.43.243","205.185.216.42","TCP","54","[TCP Keep-Alive ACK] 55357  >  80 [ACK] Seq=891 Ack=72749 Win=621 Len=0"
"232","1.081079","205.185.216.42","192.168.43.243","TCP","444","80  >  55357 [PSH, ACK] Seq=72749 Ack=891 Win=60 Len=390 [TCP segment of a reassembled PDU]"
"233","1.085316","205.185.216.42","192.168.43.243","TCP","1424","80  >  55357 [ACK] Seq=73139 Ack=891 Win=60 Len=1370 [TCP segment of a reassembled PDU]"
"234","1.085820","192.168.43.243","205.185.216.42","TCP","54","55357  >  80 [ACK] Seq=891 Ack=74509 Win=626 Len=0"
"235","1.086202","2405:204:919e:7f6f:c9a4:1a10:85cb:e7af","2606:4700:20::6819:da15","TLSv1.2","167","Client Key Exchange, Change Cipher Spec, Encrypted Handshake Message"
"236","1.086497","205.185.216.42","192.168.43.243","TCP","1424","80  >  55357 [ACK] Seq=74509 Ack=891 Win=60 Len=1370 [TCP segment of a reassembled PDU]"
"237","1.087353","205.185.216.42","192.168.43.243","TCP","1410","80  >  55357 [PSH, ACK] Seq=75879 Ack=891 Win=60 Len=1356 [TCP segment of a reassembled PDU]"
"238","1.087800","205.185.216.42","192.168.43.243","TCP","1424","80  >  55357 [ACK] Seq=77235 Ack=891 Win=60 Len=1370 [TCP segment of a reassembled PDU]"
"239","1.087844","192.168.43.243","205.185.216.42","TCP","54","55357  >  80 [ACK] Seq=891 Ack=77235 Win=626 Len=0"
"240","1.089396","205.185.216.42","192.168.43.243","TCP","1424","80  >  55357 [ACK] Seq=78605 Ack=891 Win=60 Len=1370 [TCP segment of a reassembled PDU]"
"241","1.089797","192.168.43.243","205.185.216.42","TCP","54","55357  >  80 [ACK] Seq=891 Ack=79975 Win=626 Len=0"
"242","1.091938","205.185.216.42","192.168.43.243","TCP","1424","80  >  55357 [ACK] Seq=79975 Ack=891 Win=60 Len=1370 [TCP segment of a reassembled PDU]"
"243","1.091940","205.185.216.42","192.168.43.243","TCP","1424","80  >  55357 [ACK] Seq=81345 Ack=891 Win=60 Len=1370 [TCP segment of a reassembled PDU]"
"244","1.092541","205.185.216.42","192.168.43.243","TCP","1424","80  >  55357 [ACK] Seq=82715 Ack=891 Win=60 Len=1370 [TCP segment of a reassembled PDU]"
"245","1.092856","192.168.43.243","205.185.216.42","TCP","54","55357  >  80 [ACK] Seq=891 Ack=82715 Win=626 Len=0"
"246","1.092930","205.185.216.42","192.168.43.243","TCP","1396","80  >  55357 [PSH, ACK] Seq=84085 Ack=891 Win=60 Len=1342 [TCP segment of a reassembled PDU]"
"247","1.093217","205.185.216.42","192.168.43.243","TCP","1424","80  >  55357 [ACK] Seq=85427 Ack=891 Win=60 Len=1370 [TCP segment of a reassembled PDU]"
"248","1.093413","192.168.43.243","205.185.216.42","TCP","54","55357  >  80 [ACK] Seq=891 Ack=85427 Win=626 Len=0"
"249","1.094858","205.185.216.42","192.168.43.243","TCP","1424","80  >  55357 [ACK] Seq=86797 Ack=891 Win=60 Len=1370 [TCP segment of a reassembled PDU]"
"250","1.095274","192.168.43.243","205.185.216.42","TCP","54","55357  >  80 [ACK] Seq=891 Ack=88167 Win=626 Len=0"
"251","1.103189","205.185.216.42","192.168.43.243","TCP","1410","80  >  55357 [PSH, ACK] Seq=88167 Ack=891 Win=60 Len=1356 [TCP segment of a reassembled PDU]"
"252","1.103191","205.185.216.42","192.168.43.243","TCP","1424","80  >  55357 [ACK] Seq=89523 Ack=891 Win=60 Len=1370 [TCP segment of a reassembled PDU]"
"253","1.103195","205.185.216.42","192.168.43.243","TCP","1424","80  >  55357 [ACK] Seq=90893 Ack=891 Win=60 Len=1370 [TCP segment of a reassembled PDU]"
"254","1.103195","205.185.216.42","192.168.43.243","TCP","1410","80  >  55357 [PSH, ACK] Seq=92263 Ack=891 Win=60 Len=1356 [TCP segment of a reassembled PDU]"
"255","1.103196","205.185.216.42","192.168.43.243","TCP","1424","80  >  55357 [ACK] Seq=93619 Ack=891 Win=60 Len=1370 [TCP segment of a reassembled PDU]"
"256","1.103198","205.185.216.42","192.168.43.243","TCP","1424","80  >  55357 [ACK] Seq=94989 Ack=891 Win=60 Len=1370 [TCP segment of a reassembled PDU]"
"257","1.104321","205.185.216.42","192.168.43.243","TCP","1424","80  >  55357 [ACK] Seq=96359 Ack=891 Win=60 Len=1370 [TCP segment of a reassembled PDU]"
"258","1.104631","192.168.43.243","205.185.216.42","TCP","54","55357  >  80 [ACK] Seq=891 Ack=90893 Win=626 Len=0"
"259","1.104981","192.168.43.243","205.185.216.42","TCP","54","55357  >  80 [ACK] Seq=891 Ack=93619 Win=626 Len=0"
"260","1.105253","192.168.43.243","205.185.216.42","TCP","54","55357  >  80 [ACK] Seq=891 Ack=96359 Win=626 Len=0"
"261","1.105535","205.185.216.42","192.168.43.243","TCP","1424","80  >  55357 [ACK] Seq=97729 Ack=891 Win=60 Len=1370 [TCP segment of a reassembled PDU]"
"262","1.106366","192.168.43.243","205.185.216.42","TCP","54","55357  >  80 [ACK] Seq=891 Ack=99099 Win=626 Len=0"
"263","1.106613","205.185.216.42","192.168.43.243","TCP","1424","80  >  55357 [ACK] Seq=99099 Ack=891 Win=60 Len=1370 [TCP segment of a reassembled PDU]"
"264","1.107646","205.185.216.42","192.168.43.243","TCP","1396","80  >  55357 [PSH, ACK] Seq=100469 Ack=891 Win=60 Len=1342 [TCP segment of a reassembled PDU]"
"265","1.107648","205.185.216.42","192.168.43.243","TCP","1424","80  >  55357 [ACK] Seq=101811 Ack=891 Win=60 Len=1370 [TCP segment of a reassembled PDU]"
"266","1.107651","205.185.216.42","192.168.43.243","TCP","1424","80  >  55357 [ACK] Seq=103181 Ack=891 Win=60 Len=1370 [TCP segment of a reassembled PDU]"
"267","1.108451","192.168.43.243","205.185.216.42","TCP","54","55357  >  80 [ACK] Seq=891 Ack=101811 Win=626 Len=0"
"268","1.108828","192.168.43.243","205.185.216.42","TCP","54","55357  >  80 [ACK] Seq=891 Ack=104551 Win=626 Len=0"
"269","1.109771","205.185.216.42","192.168.43.243","TCP","1424","80  >  55357 [ACK] Seq=104551 Ack=891 Win=60 Len=1370 [TCP segment of a reassembled PDU]"
"270","1.110778","2405:204:919e:7f6f:c9a4:1a10:85cb:e7af","2405:200:1602::312c:769e","TCP","74","55383  >  80 [ACK] Seq=238 Ack=712 Win=16896 Len=0"
"271","1.112808","205.185.216.42","192.168.43.243","TCP","1424","80  >  55357 [ACK] Seq=105921 Ack=891 Win=60 Len=1370 [TCP segment of a reassembled PDU]"
"272","1.113455","192.168.43.243","205.185.216.42","TCP","54","55357  >  80 [ACK] Seq=891 Ack=107291 Win=626 Len=0"
"273","1.113747","205.185.216.42","192.168.43.243","TCP","1424","80  >  55357 [ACK] Seq=107291 Ack=891 Win=60 Len=1370 [TCP segment of a reassembled PDU]"
"274","1.113749","205.185.216.42","192.168.43.243","TCP","1424","80  >  55357 [ACK] Seq=108661 Ack=891 Win=60 Len=1370 [TCP segment of a reassembled PDU]"
"275","1.115153","192.168.43.243","205.185.216.42","TCP","54","55357  >  80 [ACK] Seq=891 Ack=110031 Win=626 Len=0"
"276","1.116418","205.185.216.42","192.168.43.243","TCP","1424","80  >  55357 [ACK] Seq=110031 Ack=891 Win=60 Len=1370 [TCP segment of a reassembled PDU]"
"277","1.116420","205.185.216.42","192.168.43.243","TCP","1424","80  >  55357 [ACK] Seq=111401 Ack=891 Win=60 Len=1370 [TCP segment of a reassembled PDU]"
"278","1.116423","205.185.216.42","192.168.43.243","TCP","1424","80  >  55357 [ACK] Seq=112771 Ack=891 Win=60 Len=1370 [TCP segment of a reassembled PDU]"
"279","1.116424","205.185.216.42","192.168.43.243","TCP","1424","80  >  55357 [ACK] Seq=114141 Ack=891 Win=60 Len=1370 [TCP segment of a reassembled PDU]"
"280","1.116425","205.185.216.42","192.168.43.243","TCP","1424","80  >  55357 [ACK] Seq=115511 Ack=891 Win=60 Len=1370 [TCP segment of a reassembled PDU]"
"281","1.117414","205.185.216.42","192.168.43.243","TCP","1368","80  >  55357 [PSH, ACK] Seq=116881 Ack=891 Win=60 Len=1314 [TCP segment of a reassembled PDU]"
"282","1.117661","205.185.216.42","192.168.43.243","TCP","1424","80  >  55357 [ACK] Seq=118195 Ack=891 Win=60 Len=1370 [TCP segment of a reassembled PDU]"
"283","1.117887","192.168.43.243","205.185.216.42","TCP","54","55357  >  80 [ACK] Seq=891 Ack=112771 Win=626 Len=0"
"284","1.118274","192.168.43.243","205.185.216.42","TCP","54","55357  >  80 [ACK] Seq=891 Ack=115511 Win=626 Len=0"
"285","1.118707","192.168.43.243","205.185.216.42","TCP","54","55357  >  80 [ACK] Seq=891 Ack=118195 Win=626 Len=0"
"286","1.118974","205.185.216.42","192.168.43.243","TCP","1424","80  >  55357 [ACK] Seq=119565 Ack=891 Win=60 Len=1370 [TCP segment of a reassembled PDU]"
"287","1.118975","205.185.216.42","192.168.43.243","TCP","1424","80  >  55357 [ACK] Seq=120935 Ack=891 Win=60 Len=1370 [TCP segment of a reassembled PDU]"
"288","1.120174","192.168.43.243","205.185.216.42","TCP","54","55357  >  80 [ACK] Seq=891 Ack=120935 Win=626 Len=0"
"289","1.121415","205.185.216.42","192.168.43.243","TCP","1424","80  >  55357 [ACK] Seq=122305 Ack=891 Win=60 Len=1370 [TCP segment of a reassembled PDU]"
